{
  "user_agent_string": "Mozilla/5.0 (X11; Linux x86_64) AppleWebKit/537.36 (KHTML, like Gecko) Chrome/143.0.0.0 Safari/537.36 Edg/143.0.0.0",
  "name": "Edge",
  "type": "Browser",
  "version": "143",
  "version_major": "143",
  "device": {
    "name": "Linux Desktop",
    "type": "Desktop",
    "brand": "Unknown",
    "cpu": "Intel x86_64"
  },
  "engine": {
    "name": "Blink",
    "type": "Browser",
    "version": "143",
    "version_major": "143"
  },
  "operating_system": {
    "name": "Linux",
    "type": "Desktop",
    "version": "??",
    "version_major": "??",
    "build": "??"
  }
}